{
    "$schema": "https://json-schema.org/draft/2020-12/schema",
    "$id": "WorkflowDefinitionV1.json",
    "type": "object",
    "properties": {
        "schemaVersion": {
            "type": "string",
            "const": "1.0",
            "description": "Wire-IR schema version: pinned literal `1.0`. While the Contracts package\nis pre-1.0 a minor may narrow this document in place and every narrowing\nmust be listed in `schemas/breaking-changes.allowlist.json`; after 1.0 a\nbreaking change requires a V2 root."
        },
        "name": {
            "type": "string",
            "minLength": 1,
            "pattern": ".*\\S.*",
            "description": "Workflow name (the IR identity, matches the builder's `WorkflowDefinition.Name`)."
        },
        "steps": {
            "type": "array",
            "items": {
                "$ref": "StepDefinition.json"
            },
            "description": "Ordered step definitions (the discriminated `StepDefinition` union)."
        },
        "transitions": {
            "type": "array",
            "items": {
                "$ref": "TransitionDefinition.json"
            },
            "description": "Directed transitions between steps."
        },
        "branchPoints": {
            "type": "array",
            "items": {
                "$ref": "BranchPointDefinition.json"
            },
            "description": "Branch points (conditional fan-out)."
        },
        "loops": {
            "type": "array",
            "items": {
                "$ref": "LoopDefinition.json"
            },
            "description": "Loops (RepeatUntil constructs)."
        },
        "forkPoints": {
            "type": "array",
            "items": {
                "$ref": "ForkPointDefinition.json"
            },
            "description": "Fork points (concurrent fan-out / join)."
        },
        "failureHandlers": {
            "type": "array",
            "items": {
                "$ref": "FailureHandlerDefinition.json"
            },
            "description": "Workflow-scoped failure handlers."
        },
        "approvalPoints": {
            "type": "array",
            "items": {
                "$ref": "ApprovalDefinition.json"
            },
            "description": "Approval points (human-approval pauses)."
        },
        "gates": {
            "type": "array",
            "items": {
                "$ref": "GateDeclaration.json"
            },
            "description": "Gate declarations for this workflow (#150, DR-3). Consumer-plane data: the\ngenerated saga does NOT consume gates — they flow through the shared wire IR\nso both runtimes see the same gate vocabulary from birth. OPTIONAL and\nadditive; a workflow with no declared gates omits the slot entirely.\n\nA GateStep may back-reference a declaration here by its `gateId`. That a\n`gateId` must name an id present in this list is a semantic rule JSON Schema\ncannot express (see README, \"Dangling gateId\"); the build-time import\nfront-end enforces it (DR-13/DR-15), not this schema."
        },
        "diagnosticForks": {
            "type": "array",
            "items": {
                "$ref": "DiagnosticForkDefinition.json"
            },
            "description": "Diagnostic fork edges for this workflow (#151, DR-10). The DECLARATIVE half of\nthe fork/compensation edge (DR-7): where the workflow may fork, the closed\ntriggers permitted with their evidence-ref schema, the `maxForks` bound, and\nthe compensation seed. OPTIONAL and additive — a workflow with no fork edge\nomits the slot entirely, so this is a NON-BREAKING wire change.\n\nINV-8: every reference inside a DiagnosticForkDefinition is a string moniker,\nnever a CLR type. The generated saga lowers the edge (DR-9); the runtime\ncompanion is ForkOccurrence (DR-8) in the Events family."
        },
        "entryStepId": {
            "type": "string",
            "description": "Step id of the workflow entry step, if set."
        },
        "terminalStepId": {
            "type": "string",
            "description": "Step id of the workflow terminal step, if set."
        }
    },
    "required": [
        "schemaVersion",
        "name",
        "steps",
        "transitions",
        "branchPoints",
        "loops",
        "forkPoints",
        "failureHandlers",
        "approvalPoints"
    ],
    "description": "Wire-IR root for a serialized Strategos workflow (issue #50).\n\nThis is the **wire contract** — the flat, language-neutral document that\ncross-product consumers (Exarchos Zod, Basileus, visualization, schema diff)\nread. It is the export-only projection target of the in-memory builder IR\n`WorkflowDefinition<TState>` (see `WorkflowDefinitionProjection.ToContract`):\nthe projection drops executable code (LB-1) and reduces CLR `System.Type`\nhandles to simple-name string monikers (LB-2).\n\n`schemaVersion` is a pinned literal `1.0`. While the Contracts package is\npre-1.0 a minor may narrow this document in place, and every narrowing must\nbe listed in `schemas/breaking-changes.allowlist.json`; after 1.0 a breaking\nchange requires a V2 root."
}